<?xml version="1.0" encoding="utf-8"?>
<?xml-stylesheet type="text/xsl" href="MachinesInOperation.xslt" ?>
<MachinesInOperation xmlns:xsi="http://www.w3.org/2001/XMLSchema-instance" xsi:noNamespaceSchemaLocation="MachinesInOperation.xsd">
  
  <ActiveMachine MachineID ="40001">
    <MachineInfo
     City="Vaughan"
     ContractStartDate="2012-04-01"
     NextRestock="2012-11-01">
     <ModelName>Vendmaster 2000</ModelName>
     <CustomerID>10009</CustomerID>
     <Name>James Lee</Name>
     <Address>9580 Jane Street</Address>
     <PostalCode>L6A 1S6</PostalCode> 
      <MachineImage>images/VendMaster 2000.jpg</MachineImage>
    </MachineInfo>
    <Items>
      <Item>Diet Coke</Item>
      <Item>Pepsi Lime</Item>
      <Item>Quaker chocolate chunk cookies</Item>
      <Item>Monster Energy</Item>      
    </Items>
  </ActiveMachine>
  <ActiveMachine MachineID="40002">
    <MachineInfo
     City="Peterborough"
     ContractStartDate="2012-05-01"
     NextRestock="2012-11-12">
      <ModelName>ProVendor</ModelName>
      <CustomerID>10003</CustomerID>
      <Name>Billy Bob</Name>
      <Address>4235 E Spruce Drive</Address>
      <PostalCode>L3L 3T2</PostalCode>
      <MachineImage>images/ProVendor.jpg</MachineImage>
    </MachineInfo>
    <Items>
      <Item>Root Beer Barq's</Item>
      <Item>Dr Pepper</Item>
      <Item>Diet Coke</Item>
      <Item>Canada Dry</Item>
    </Items>
  </ActiveMachine>
  <ActiveMachine MachineID="40004">
    <MachineInfo
     City="Oshawa"
     ContractStartDate="2012-08-01"
     NextRestock="2012-11-10">
      <ModelName>Vendmaster 3000</ModelName>
      <CustomerID>10006</CustomerID>
      <Name>Jane Parker</Name>
      <Address>892 Brady Road</Address>
      <PostalCode>O4Y 9Q1</PostalCode>
      <MachineImage>images/Vendmaster 3000.jpg</MachineImage>
    </MachineInfo>
    <Items>
      <Item>Pepsi</Item>
      <Item>7 Up</Item>
      <Item>Diet Coke</Item>
      <Item>Original two bite brownies</Item>
    </Items>
  </ActiveMachine>
  <ActiveMachine MachineID="40005">
    <MachineInfo
      City="Toronto"
      ContractStartDate="2012-09-01"
      NextRestock="2012-11-01">
      <ModelName>Vendmaster 3000</ModelName>
      <CustomerID>10004</CustomerID>
      <Name>John Smith</Name>
      <Address>8234 Market Street</Address>
      <PostalCode>M1G 1C2</PostalCode>
      <MachineImage>images/VendMaster 3000.jpg</MachineImage>
    </MachineInfo>
    <Items>
      <Item>Doritos nacho cheese</Item>
      <Item>Dentyne ice vanilla frost</Item>
      <Item>Quaker chocolate chunk cookies</Item>
      <Item>Ruffles all dressed</Item>
    </Items>
  </ActiveMachine>
  <ActiveMachine MachineID="40007">
    <MachineInfo
       City="Toronto"
       ContractStartDate="2012-09-01"
       NextRestock="2012-11-20">
      <ModelName>iVend</ModelName>
      <CustomerID>10002</CustomerID>
      <Name>Daniel Frankie</Name>
      <Address>1234 Hello Road</Address>
      <PostalCode>M1G 5G7</PostalCode>
      <MachineImage>images/iVend.jpg</MachineImage>
    </MachineInfo>
    <Items>
      <Item>Pepsi Lime</Item>
      <Item>Pepsi</Item>
      <Item>Dr Pepper</Item>
      <Item>Doritos nacho cheese</Item>
    </Items>
  </ActiveMachine>
  <ActiveMachine MachineID="40009">
    <MachineInfo
       City="Hamilton"
       ContractStartDate="2012-08-01"
       NextRestock="2012-11-22">
      <ModelName>Vendmaster 4000</ModelName>
      <CustomerID>10007</CustomerID>
      <Name>Harry Oswald</Name>
      <Address>627F Madison Palace</Address>
      <PostalCode>N6J 3B3</PostalCode>
      <MachineImage>images/VendMaster 4000.jpg</MachineImage>
    </MachineInfo>
    <Items>
      <Item>Monster Energy</Item>
      <Item>Root Beer Barq's</Item>
      <Item>7 Up</Item>
      <Item>Dr Pepper</Item>
      <Item>Nestea cool</Item>
    </Items>
  </ActiveMachine>
  <ActiveMachine MachineID="40010">
    <MachineInfo
       City="Mississauga"
       ContractStartDate="2012-07-01"
       NextRestock="2012-11-24">
      <ModelName>Vendmaster 4000</ModelName>
      <CustomerID>10008</CustomerID>
      <Name>Lisa Ann</Name>
      <Address>1024 Eglinton Square</Address>
      <PostalCode>V4H 3W7</PostalCode>
      <MachineImage>images/VendMaster 4000.jpg</MachineImage>
    </MachineInfo>
    <Items>
      <Item>Pepsi Lime</Item>
      <Item>Pepsi</Item>
      <Item>7 Up</Item>
      <Item>Monster Energy</Item>
      <Item>Doritos nacho cheese</Item>
    </Items>
  </ActiveMachine>
  <ActiveMachine MachineID="40011">
    <MachineInfo
       City="Oshawa"
       ContractStartDate="2012-05-01"
       NextRestock="2012-10-11">
      <ModelName>Vendmaster 4000</ModelName>
      <CustomerID>10001</CustomerID>
      <Name>Tim Scott</Name>
      <Address>2000 Simcoe Street North</Address>
      <PostalCode>L1M 3Z3</PostalCode>
      <MachineImage>images/VendMaster 4000.jpg</MachineImage>
    </MachineInfo>
    <Items>
      <Item>Original two bite brownies</Item>
      <Item>Quaker chocolate chunk cookies</Item>
      <Item>Doritos nacho cheese</Item>
      <Item>Dentyne ice vanilla frost</Item>
    </Items>
  </ActiveMachine>
  <ActiveMachine MachineID="40012">
    <MachineInfo
       City="Toronto"
       ContractStartDate="2012-09-01"
       NextRestock="2012-11-29">
      <ModelName>iVend 2.0</ModelName>
      <CustomerID>10005</CustomerID>
      <Name>Mary Doe</Name>
      <Address>2834 Garden Place</Address>
      <PostalCode>O6H 5Q1</PostalCode>
      <MachineImage>images/iVend 2.0.jpg</MachineImage>
    </MachineInfo>
    <Items>
      <Item>Original two bite brownies</Item>
      <Item>Quaker chocolate chunk cookies</Item>
      <Item>Dr Pepper</Item>
      <Item>Nestea cool</Item>
    </Items>
  </ActiveMachine>
</MachinesInOperation>